{
  "$schema": "https://json-schema.org/draft/2020-12/schema",
  "$id": "file:schemas/mcp4h-0.1.1.schema.json",
  "title": "MCP4Hâ„¢ v0.1.1 Envelope (with extensions)",
  "type": "object",
  "additionalProperties": false,
  "required": [
    "version",
    "id",
    "timestamp",
    "origin",
    "actor",
    "metadata"
  ],
  "properties": {
    "version": {
      "type": "string",
      "const": "mcp4h/0.1.1"
    },
    "id": {
      "type": "string",
      "format": "uuid"
    },
    "timestamp": {
      "type": "string",
      "format": "date-time"
    },
    "origin": {
      "type": "object",
      "additionalProperties": false,
      "required": [
        "platform"
      ],
      "properties": {
        "platform": {
          "type": "string"
        },
        "relation": {
          "type": "string",
          "enum": [
            "dm",
            "mention",
            "tag",
            "comment",
            "reply",
            "post",
            "system",
            "telemetry",
            "other"
          ]
        }
      }
    },
    "actor": {
      "type": "object",
      "additionalProperties": false,
      "required": [
        "role"
      ],
      "properties": {
        "role": {
          "type": "string",
          "enum": [
            "sender",
            "recipient",
            "system"
          ]
        },
        "handle": {
          "type": "string"
        }
      }
    },
    "text": {
      "type": "string"
    },
    "metadata": {
      "type": "object",
      "additionalProperties": false,
      "required": [
        "heat",
        "valence"
      ],
      "properties": {
        "heat": {
          "type": "integer",
          "minimum": 0,
          "maximum": 3
        },
        "valence": {
          "type": "string",
          "enum": [
            "positive",
            "neutral",
            "negative",
            "mixed"
          ]
        },
        "tone": {
          "type": "string"
        },
        "civility_flags": {
          "type": "array",
          "items": {
            "type": "string",
            "enum": [
              "labeling",
              "motive_attribution",
              "ad_hominem",
              "tone_attack",
              "guilt_by_association",
              "purity_test",
              "name_calling"
            ]
          },
          "uniqueItems": true
        },
        "reasoning_moves": {
          "type": "array",
          "items": {
            "type": "string",
            "enum": [
              "steelman",
              "claim",
              "tradeoffs",
              "receipts",
              "curious_close"
            ]
          },
          "uniqueItems": true
        },
        "constraints_detected": {
          "type": "array",
          "items": {
            "type": "string",
            "enum": [
              "cost",
              "time",
              "weight",
              "battery",
              "complexity",
              "risk",
              "privacy",
              "safety",
              "latency",
              "bandwidth",
              "traction",
              "grip"
            ]
          },
          "uniqueItems": true
        },
        "urgency": {
          "type": "string",
          "enum": [
            "low",
            "normal",
            "high"
          ]
        },
        "confidence": {
          "type": "number",
          "minimum": 0,
          "maximum": 1
        },
        "visual_cues": {
          "type": "object",
          "additionalProperties": false,
          "properties": {
            "emoji": {
              "type": "array",
              "items": {
                "type": "string"
              }
            },
            "meme_labels": {
              "type": "array",
              "items": {
                "type": "string"
              }
            },
            "alt_text": {
              "type": "string"
            }
          }
        },
        "platform_hints": {
          "type": "object",
          "additionalProperties": false,
          "properties": {
            "schedule": {
              "type": "array",
              "items": {
                "type": "string"
              }
            },
            "link_handling": {
              "type": "string"
            },
            "threading": {
              "type": "boolean"
            }
          }
        },
        "domain_profile": {
          "type": "string"
        },
        "mcp": {
          "type": "object",
          "additionalProperties": false,
          "properties": {
            "server": {
              "type": "string"
            },
            "tool": {
              "type": "string"
            },
            "trace_id": {
              "type": "string"
            },
            "method": {
              "type": "string"
            }
          }
        },
        "server": {
          "type": "string"
        },
        "tool": {
          "type": "string"
        },
        "trace_id": {
          "type": "string"
        },
        "method": {
          "type": "string"
        }
      }
    },
    "extensions": {
      "type": "object",
      "additionalProperties": true,
      "properties": {
        "traction_leds": {
          "type": "object",
          "additionalProperties": false,
          "required": [
            "unit",
            "values"
          ],
          "properties": {
            "unit": {
              "type": "string",
              "enum": [
                "slip_ratio",
                "slip_angle",
                "traction_percent"
              ]
            },
            "values": {
              "type": "object",
              "additionalProperties": false,
              "properties": {
                "LF": {
                  "type": "number"
                },
                "RF": {
                  "type": "number"
                },
                "LR": {
                  "type": "number"
                },
                "RR": {
                  "type": "number"
                }
              },
              "required": [
                "LF",
                "RF",
                "LR",
                "RR"
              ]
            },
            "severity": {
              "type": "object",
              "additionalProperties": false,
              "properties": {
                "LF": {
                  "type": "string",
                  "enum": [
                    "ok",
                    "warning",
                    "critical"
                  ]
                },
                "RF": {
                  "type": "string",
                  "enum": [
                    "ok",
                    "warning",
                    "critical"
                  ]
                },
                "LR": {
                  "type": "string",
                  "enum": [
                    "ok",
                    "warning",
                    "critical"
                  ]
                },
                "RR": {
                  "type": "string",
                  "enum": [
                    "ok",
                    "warning",
                    "critical"
                  ]
                }
              }
            },
            "colors": {
              "type": "object",
              "additionalProperties": false,
              "properties": {
                "LF": {
                  "type": "string",
                  "pattern": "^#([A-Fa-f0-9]{6})$"
                },
                "RF": {
                  "type": "string",
                  "pattern": "^#([A-Fa-f0-9]{6})$"
                },
                "LR": {
                  "type": "string",
                  "pattern": "^#([A-Fa-f0-9]{6})$"
                },
                "RR": {
                  "type": "string",
                  "pattern": "^#([A-Fa-f0-9]{6})$"
                }
              }
            },
            "blink": {
              "type": "object",
              "additionalProperties": false,
              "properties": {
                "LF": {
                  "type": "boolean"
                },
                "RF": {
                  "type": "boolean"
                },
                "LR": {
                  "type": "boolean"
                },
                "RR": {
                  "type": "boolean"
                }
              }
            }
          }
        }
      }
    },
    "cues": {
      "type": "array",
      "items": {
        "$ref": "../spec/cues/cue.schema.json"
      }
    },
    "behavior_policy": {
      "$ref": "../spec/behavior/policy.schema.json"
    },
    "renderer_capabilities": {
      "$ref": "../spec/behavior/capabilities.schema.json"
    }
  }
}
