{
  "version": "mcp4h/0.1.1",
  "id": "b7029107-66cc-4233-8042-3271f577567b",
  "timestamp": "2025-09-22T02:12:19Z",
  "origin": {
    "platform": "simhub",
    "relation": "telemetry"
  },
  "actor": {
    "role": "system",
    "handle": "local_sim"
  },
  "text": "",
  "metadata": {
    "heat": 1,
    "valence": "neutral",
    "tone": "telemetry",
    "constraints_detected": [
      "traction",
      "grip"
    ]
  },
  "extensions": {
    "traction_leds": {
      "unit": "slip_ratio",
      "values": {
        "LF": 0.04,
        "RF": 0.03,
        "LR": 0.18,
        "RR": 0.22
      },
      "severity": {
        "LF": "ok",
        "RF": "ok",
        "LR": "warning",
        "RR": "critical"
      },
      "colors": {
        "LF": "#1FDB51",
        "RF": "#1FDB51",
        "LR": "#FFCC00",
        "RR": "#FF3B30"
      },
      "blink": {
        "LF": false,
        "RF": false,
        "LR": true,
        "RR": true
      }
    }
  }
}
