{
  "version": "mcp4h/0.1.1",
  "id": "fc6fe05b-ece3-4d48-9eda-73341dc191fa",
  "timestamp": "2026-03-07T23:00:38.139065+00:00",
  "origin": {
    "platform": "mcp",
    "relation": "telemetry"
  },
  "actor": {
    "role": "system",
    "handle": "agent:local"
  },
  "text": "Tool completed filesystem.read returned text.",
  "metadata": {
    "heat": 0,
    "valence": "neutral",
    "domain_profile": "comms.toolcall",
    "mcp": {
      "server": "mcp-server-local",
      "tool": "filesystem.read",
      "trace_id": "trace_abc",
      "method": "tools/call"
    }
  },
  "cues": [
    {
      "id": "cue-proj-001",
      "ts": "2026-03-07T23:00:38.139065+00:00",
      "channel": "multi",
      "intent": "inform",
      "payload": {
        "text": {
          "short": "Tool completed",
          "long": "filesystem.read returned text.",
          "style": "neutral"
        },
        "visual": {
          "led": {
            "color": "#00FF66",
            "blink_hz": 2,
            "ttl_ms": 300
          }
        },
        "audio": {
          "mode": "beep",
          "beep": "single"
        },
        "haptic": {
          "pattern": "double_tap",
          "intensity": 0.4,
          "duration_ms": 180
        }
      }
    }
  ]
}
